### ISSUE TITLE
Xdpcap tool Can't matched any packets while set filter string with"udp"(for example . or Others filter condition)， but in fact there are .

### ISSUE THREAD

**Issue by marshalWS** [cilium/ebpf#140]
Xdpcap tool Can't matched any packets while set filter string with"udp"(for example . or Others filter condition)， but in fact there are .
'
What's puzzling is that sometimes, sometimes not。

[root@xxxxx xx]# ./xdpcap_new /sys/fs/bpf/xdp/globals/action_map pp.pcap
aborted: 0/0 drop: 0/0 pass: 49/49 tx: 0/0 redirect: 0/0 (received/matched packets)
aborted: 0/0 drop: 0/0 pass: 96/96 tx: 0/0 redirect: 0/0 (received/matched packets)
aborted: 0/0 drop: 0/0 pass: 145/145 tx: 0/0 redirect: 0/0 (received/matched packets)
aborted: 0/0 drop: 0/0 pass: 202/202 tx: 0/0 redirect: 0/0 (received/matched packets)
aborted: 0/0 drop: 0/0 pass: 250/250 tx: 0/0 redirect: 0/0 (received/matched packets)

^C[root@xxxxx xx]# ./xdpcap_new /sys/fs/bpf/xdp/globals/action_map pp.pcap "udp"
aborted: 0/0 drop: 0/0 pass: 51/0 tx: 0/0 redirect: 0/0 (received/matched packets)
aborted: 0/0 drop: 0/0 pass: 102/0 tx: 0/0 redirect: 0/0 (received/matched packets)
aborted: 0/0 drop: 0/0 pass: 153/0 tx: 0/0 redirect: 0/0 (received/matched packets)
aborted: 0/0 drop: 0/0 pass: 213/0 tx: 0/0 redirect: 0/0 (received/matched packets)
aborted: 0/0 drop: 0/0 pass: 264/0 tx: 0/0 redirect: 0/0 (received/matched packets)
aborted: 0/0 drop: 0/0 pass: 314/0 tx: 0/0 redirect: 0/0 (received/matched packets)
aborted: 0/0 drop: 0/0 pass: 359/0 tx: 0/0 redirect: 0/0 (received/matched packets)

[root@xxxxx xx]# tcpdump -i ens3 udp
tcpdump: verbose output suppressed, use -v or -vv for full protocol decode
listening on ens3, link-type EN10MB (Ethernet), capture size 262144 bytes
11:24:13.894404 IP6 2409:8086:8413:2783::1.49229 > 2020:20:255:2::1.bfd-echo: BFD, Echo, length: 24
11:24:13.894460 IP6 2409:8086:8413:2783::1.49229 > 2020:20:255:2::1.bfd-echo: BFD, Echo, length: 24
11:24:13.990999 IP6 2409:8086:8413:2784::1.49202 > 2020:20:255:3::1.bfd-echo: BFD, Echo, length: 24
11:24:13.991103 IP6 2409:8086:8413:2784::1.49202 > 2020:20:255:3::1.bfd-echo: BFD, Echo, length: 24
11:24:14.020888 IP6 2409:8086:8413:2782::1.49207 > 2020:20:255:1::1.bfd-echo: BFD, Echo, length: 24
11:24:14.020927 IP6 2409:8086:8413:2782::1.49207 > 2020:20:255:1::1.bfd-echo: BFD, Echo, length: 24
'
for {
if len(pr.epollRings) == 0 {

                  **-- Code  is  blocked here..**
		**nEvents, err := unix.EpollWait(pr.epollFd, pr.epollEvents, -1)**      

		if temp, ok := err.(temporaryError); ok && temp.Temporary() {
			// Retry the syscall if we we're interrupted, see https://github.com/golang/go/issues/20400
			continue
		}

		if err != nil {
			return Record{}, err
		}
